fuente,external_id,nombre,descripcion,categoria,tipo_plantilla,municipio,territorio,direccion,lat,lng,telefono,email,website,es_lluvia,es_carrito,es_cambiador,es_silla_ruedas,es_mascotas,edad_minima
,https://turismoa.euskadi.eus/es/top-viajes/urola-un-recorrido-por-su-patrimonio-historico-y-arquitectonico/webtur00-content/es/,"Urola, un recorrido por su patrimonio histórico y arquitectónico","Os proponemos realizar un recorrido por el patrimonio cultural de la comarca de Urola, que escond...",plan,Experiencias Top,Azpeitia,gipuzkoa,,43.1744919,-2.2823503,,,,True,False,False,True,False,6
,https://turismoa.euskadi.eus/es/top-viajes/amantes-de-la-arquitectura/webtur00-content/es/,Para amantes de la arquitectura,Te proponemos una manera diferente de descubrir la historia de estos 4 pueblos de la comarca de O...,plan,Experiencias Top,Oiartzun;Errenteria;Lezo;Pasaia,gipuzkoa,,,,,,,False,False,False,False,False,6
,https://turismoa.euskadi.eus/es/top-viajes/5-paradas-en-la-historia-un-recorrido-en-familia-por-urola/webtur00-content/es/,"5 paradas en la historia, un recorrido en familia por Urola",Os proponemos conocer la comarca de Urola en familia a través de su programa “5 para...,plan,Experiencias Top,Azpeitia;Zestoa;Zumaia,gipuzkoa,,,,,,,True,False,False,True,False,4
,https://turismoa.euskadi.eus/es/top-viajes/en-el-corazon-de-gipuzkoa-la-gastronomia-mas-autentica/webtur00-content/es/,"En el corazón de Gipuzkoa, la gastronomía más auténtica","Cuando planificamos un viaje por Euskadi, la gastronomía siempre está presente. Te ...",plan,Experiencias Top,Azpeitia;Beizama,gipuzkoa,,,,,,,False,False,False,False,False,4
,https://turismoa.euskadi.eus/es/top-viajes/vive-una-experiencia-100-en-euskera/webtur00-content/es/,Vive una experiencia 100% en euskera,¿Estás estudiando Euskera? ¿Tus raíces son vascas? Este es un plan pe...,plan,Experiencias Top,Beizama;Azkoitia;Azpeitia;Zestoa,gipuzkoa,,,,,,,False,False,False,False,False,4
,https://turismoa.euskadi.eus/es/top-viajes/un-dia-en-familia-conociendo-oarsoaldea/webtur00-content/es/,Un día en familia conociendo Oarsoaldea,Te proponemos una jornada repleta de planes para disfrutar con los niños en la comarca de ...,plan,Experiencias Top,Pasaia;Lezo;Errenteria;Donostia / San Sebastián,gipuzkoa,,,,,,,False,True,True,False,True,4
,https://turismoa.euskadi.eus/es/top-viajes/2021-ano-ignaciano-el-camino-ignaciano-en-urola/webtur00-content/es/,"2022, Año Ignaciano: el Camino Ignaciano en Urola","Durante el 2022 se celebrará el Año Ignaciano, conmemorando los 500 años tan...",plan,Experiencias Top,Azpeitia;Azkoitia;Zumarraga,gipuzkoa,,,,,,,True,False,False,True,False,8
,https://turismoa.euskadi.eus/es/top-viajes/disfruta-y-participa-en-nuestra-gastronomia/webtur00-content/es/,Disfruta y participa en nuestra gastronomía,"Oarsoaldea ofrece numerosas opciones de ocio entre las que, como no, cabe destacar las relacionad...",plan,Experiencias Top,Pasaia;;Oiartzun,gipuzkoa,,,,,,,True,False,False,False,False,6
,https://turismoa.euskadi.eus/es/top-viajes/un-recorrido-por-el-pasado-ferroviario-la-via-verde-del-urola/webtur00-content/es/,Un recorrido por el pasado ferroviario: la Vía Verde del Urola,"Os proponemos un plan para conocer la vía verde del Urola, un atractivo itinerario apto ta...",plan,Experiencias Top,Zumarraga;Zumaia;Zestoa,gipuzkoa,,,,,,,True,False,False,False,True,8
,https://turismoa.euskadi.eus/es/top-viajes/un-dia-en-el-entorno-natural-de-izarraitz-declarado-zona-especial-de-conservacion/webtur00-content/es/,"Un día en el entorno natural de Izarraitz, declarado zona especial de conservación","PR GI-214 IZARRAIZKO BIRA, un plan para disfrutar de un día en un entorno de indiscutible ...",plan,Experiencias Top,Azkoitia;Azpeitia;Zestoa,gipuzkoa,,,,,,,False,False,False,True,False,4
,https://turismoa.euskadi.eus/es/top-viajes/descubre-la-identidad-del-pueblo-vasco/webtur00-content/es/,Descubre la identidad del pueblo vasco,Te proponemos disfrutar de varias propuestas para conocer un poquito de nuestra cultura e histori...,plan,Experiencias Top,Oiartzun;Errenteria;Pasaia,gipuzkoa,,,,,,,True,True,False,False,True,6
,https://turismoa.euskadi.eus/es/top-viajes/castillos-y-torres-de-alava/webtur00-content/es/,Castillos y Torres de Álava,Álava ha sido tierra de paso a lo largo de la historia. Y también de peleas y confl...,plan,Experiencias Top,Vitoria-Gasteiz;Zambrana,araba,,,,,,,False,False,False,True,False,6
,https://turismoa.euskadi.eus/es/top-viajes/un-dia-para-disfrutar-de-la-naturaleza-siguiendo-los-pasos-de-la-prehistoria/webtur00-content/es/,"Un día para disfrutar de la naturaleza, siguiendo los pasos de la prehistoria",Nuestra tierra presenta una riqueza megalítica envidiable que se encuentra diseminada en l...,plan,Experiencias Top,Errenteria;Oiartzun,gipuzkoa,,,,,,,False,True,False,False,False,8
,https://turismoa.euskadi.eus/es/top-viajes/un-mundo-de-traicion/webtur00-content/es/,Un mundo de tradición,Hoy es un magnífico día para coger la mochila y adentrarse en las montañas.&...,plan,Experiencias Top,Oñati,gipuzkoa,,43.0341127,-2.4171658,,,,True,False,False,False,False,6
,https://turismoa.euskadi.eus/es/top-viajes/talaia-una-ruta-con-encanto-entre-pasaia-y-hondarribia/webtur00-content/es/,"Talaia, una ruta con encanto entre Pasaia y Hondarribia",Una ruta transfronteriza que recorre el litoral desde Bidart hasta San Sebastián. El tramo...,plan,Experiencias Top,Hondarribia;Pasaia;Donostia / San Sebastián,gipuzkoa,,,,,,,True,True,False,False,False,8
,https://turismoa.euskadi.eus/es/top-viajes/a-golpe-de-pedal/webtur00-content/es/,A golpe de pedal,Tenemos la suerte de poder disponer de una senda preparada para cicloturistas utilizando el viejo...,plan,Experiencias Top,Bergara;Eskoriatza;Oñati,gipuzkoa,,,,,,,True,True,False,False,False,4
,https://turismoa.euskadi.eus/es/top-viajes/turismo-industrial-patrimonio-y-fabricas-en-activo/webtur00-content/es/,Turismo industrial: patrimonio y fábricas en activo,"Si deseas conocer nuestra cultura, nuestro patrimonio económico, cuál es la histori...",plan,Experiencias Top,Hondarribia;Errenteria,gipuzkoa,,,,,,,False,False,True,True,True,6
,https://turismoa.euskadi.eus/es/top-viajes/desde-las-alturas/webtur00-content/es/,Desde las alturas,Apostamos por un experiencia centrada en exclusiva en coronar la cima más alta de Gipuzkoa...,plan,Experiencias Top,Oñati,gipuzkoa,,42.9790708,-2.3985399,,,,False,False,False,True,False,6
,https://turismoa.euskadi.eus/es/top-viajes/sencillamente-cercano/webtur00-content/es/,Sencillamente cercano,¿Qué tal un agradable paseo descubriendo uno de los secretos mejores guardados de e...,plan,Experiencias Top,Oñati,gipuzkoa,,43.0341127,-2.4171658,,,,True,False,False,True,False,4
,https://turismoa.euskadi.eus/es/top-viajes/senderismo-en-el-parque-natural-de-aiako-harria/webtur00-content/es/,Senderismo en el Parque Natural de Aiako Harria,A caballo entre Gipuzkoa y Navarra se encuentra la imponente mole granítica de Aiako Harri...,plan,Experiencias Top,Irun;Hondarribia,gipuzkoa,,,,,,,False,True,False,True,False,6
,https://turismoa.euskadi.eus/es/top-viajes/como-nomadas/webtur00-content/es/,Como Nómadas,"Igual es el momento de peregrinar por estas tierras, sintiendo con calma como nuestros pasos no l...",plan,Experiencias Top,Arrasate/Mondragón;Leintz Gatzaga;Oñati,gipuzkoa,,,,,,,False,False,False,False,False,8
,https://turismoa.euskadi.eus/es/top-viajes/navegar-o-remar-en-el-bidasoa-y-cata-de-txakoli/webtur00-content/es/,Navegar o remar en el Bidasoa y cata de txakoli,Quizás nunca hayas navegado a vela ni hayas remado en un kayak. O quizás sí....,plan,Experiencias Top,Hondarribia;Irun,gipuzkoa,,,,,,,False,False,False,False,False,6
,https://turismoa.euskadi.eus/es/top-viajes/parque-natural-aralar-senderismo/webtur00-content/es/,Parque Natural Aralar: senderismo,Una jornada en pleno contacto con la naturaleza. Comenzaremos con un fácil paseo a los pie...,plan,Experiencias Top,Tolosa,gipuzkoa,,,,,,,False,False,False,False,True,6
,https://turismoa.euskadi.eus/es/top-viajes/amorebieta-etxano/webtur00-content/es/,Amorebieta-Etxano,Te proponemos una jornada para descubrir el municipio de Amorebieta-Etxano. Un recorrido por sus ...,plan,Experiencias Top,Amorebieta-Etxano,bizkaia,,43.2204714,-2.7330533,,,,False,True,True,True,False,6
,https://turismoa.euskadi.eus/es/top-viajes/durango-cultural/webtur00-content/es/,Durango cultural,"Te proponemos una jornada cultural callejeando por la villa de Durango, recorriendo los principal...",plan,Experiencias Top,Durango,bizkaia,,43.15810810000001,-2.6735412,,,,True,False,True,True,True,6
,https://turismoa.euskadi.eus/es/top-viajes/elorrio-un-viaje-al-pasado/webtur00-content/es/,Elorrio: un viaje al pasado,Os proponemos una jornada de senderismo y visita cultural en Elorrio. Por la mañana aprove...,plan,Experiencias Top,Elorrio,bizkaia,,43.12955890000001,-2.5423293,,,,True,True,False,True,False,6
,https://turismoa.euskadi.eus/es/top-viajes/escapada-gastronomica-al-interior-de-gipuzkoa/webtur00-content/es/,Escapada gastronómica al interior de Gipuzkoa,Escapada de fin de semana para 1 o 2 noches. La Experiencia comienza el sábado por la ma&n...,plan,Experiencias Top,Tolosa,gipuzkoa,,43.1382316,-2.071816,,,,False,False,True,True,False,6
,https://turismoa.euskadi.eus/es/top-viajes/durangaldea-tradiciones-y-naturaleza/webtur00-content/es/,Durangaldea: tradiciones y naturaleza,"Te proponemos una jornada diferente en Durangaldea, realizando las distintas tareas que realizan ...",plan,Experiencias Top,Durango,bizkaia,,43.15810810000001,-2.6735412,,,,False,True,False,False,False,8
,https://turismoa.euskadi.eus/es/top-viajes/urdaibai-bosque-txakoli-y-museo-de-la-paz/webtur00-content/es/,"Urdaibai, bosque, txakoli y Museo de la Paz",En esta experiencia conoceremos el Proyecto IMPREDECIBLE Basoa (Bosque). Un espacio natural prote...,plan,Experiencias Top,Muxika;Gernika-Lumo,bizkaia,,,,,,,False,True,False,False,True,4
,https://turismoa.euskadi.eus/es/top-viajes/senderismo-y-naturaleza-en-urdaibai/webtur00-content/es/,Senderismo y naturaleza en Urdaibai,La mejor forma de conocer la Reserva de la Biosfera de Urdaibai que realizar un paseo de Senderis...,plan,Experiencias Top,Gernika-Lumo;Mundaka;Sukarrieta;Bermeo,bizkaia,,,,,,,False,False,False,True,False,4
,https://turismoa.euskadi.eus/es/top-viajes/un-paseo-por-el-litoral-y-la-prehistoria/webtur00-content/es/,Un paseo por el litoral y la prehistoria,"Un paseo desde Elantxobe hasta Ogoño, para sentir el poder de este cabo, una de las im&aac...",plan,Experiencias Top,Elantxobe;Kortezubi,bizkaia,,,,,,,True,False,False,True,False,8
,https://turismoa.euskadi.eus/es/top-viajes/aventura-ecuestre/webtur00-content/es/,Aventura Ecuestre,Explora los valles y montes a lomos de un caballo. Este centro ecuestre ofrece paseos cortos de m...,plan,Experiencias Top,Añana;Valdegovía/Gaubea,araba,,,,,,,True,False,True,True,False,8
,https://turismoa.euskadi.eus/es/top-viajes/aventura-en-lea-artibai/webtur00-content/es/,Aventura en Lea Artibai,"Te proponemos disfrutar de una jornada de aventura, recorriendo Lekeitio desde el mar. Por la tar...",plan,Experiencias Top,Lekeitio;Markina-Xemein,bizkaia,,,,,,,False,False,False,False,False,6
,https://turismoa.euskadi.eus/es/top-viajes/descubriendo-markina-xemein/webtur00-content/es/,Descubriendo Markina-Xemein,Recorrido por Markina-Xemein visitando los puntos más emblemáticos del pueblo: la p...,plan,Experiencias Top,Markina-Xemein,bizkaia,,43.267298,-2.49628,,,,False,False,False,False,False,8
,https://turismoa.euskadi.eus/es/top-viajes/conociendo-la-parte-mas-rural-de-lea-artibai/webtur00-content/es/,Conociendo la parte más rural de Lea Artibai,"Te proponemos empezar la jornada visitando el monasterio y la colegiata de Ziortza (Zenarruza), e...",plan,Experiencias Top,Markina-Xemein;Ziortza-Bolibar;Ondarroa,bizkaia,,,,,,,True,False,False,True,False,6
,https://turismoa.euskadi.eus/es/top-viajes/conociendo-ispaster-y-ogella-la-playa-donde-mar-y-montana-se-unen/webtur00-content/es/,"Conociendo Ispaster y Ogella, la playa donde mar y montaña se unen",Nos moveremos por el paisaje rural del municipio para conocer sus históricos caserí...,plan,Experiencias Top,Ispaster,bizkaia,,43.3618594,-2.5439819,,,,True,True,True,False,False,6
,https://turismoa.euskadi.eus/es/top-viajes/goierri-pastor-por-un-dia-de-los-pastos-a-la-queseria/webtur00-content/es/,"Goierri, pastor por un día. De los pastos a la quesería","Si quieres vivir la experiencia de ser pastor por un día, si quieres conocer los pastos do...",plan,Experiencias Top,Zegama,gipuzkoa,,42.9386797,-2.2598144,,,,True,False,False,False,True,4
,https://turismoa.euskadi.eus/es/top-viajes/goirri-la-ruta-de-sara-mitologia-y-barandiaran/webtur00-content/es/,"Goierri, la ruta de Sara. Mitología y Barandiaran",Ruta vinculada a la figura de José Miguel de Barandiaran. Su casa natal de nombre Per...,plan,Experiencias Top,Ataun,gipuzkoa,,43.0079526,-2.1775707,,,,True,False,False,False,False,4
,https://turismoa.euskadi.eus/es/top-viajes/bilbao-gourmet-museo-bellas-artes/webtur00-content/es/,Bilbao gourmet & Museo Bellas Artes,Descubre la esencia cultural y gastronómica de Bilbao saboreando los mejores pro...,plan,Experiencias Top,Bilbao,bizkaia,,43.2630126,-2.9349852,,,,False,False,False,False,False,8
,https://turismoa.euskadi.eus/es/top-viajes/goierri-fin-de-semana-territorio-btt/webtur00-content/es/,Goierri fin de semana. Territorio BTT,El Goierri también es un escenario adecuado para los amantes de la bicicleta de monta...,plan,Experiencias Top,Beasain;Zegama;Segura;;Ordizia,gipuzkoa,,,,,,,False,False,False,False,False,4
,https://turismoa.euskadi.eus/es/top-viajes/pedaleando-por-bilbao-itxasmuseum/webtur00-content/es/,Pedaleando por Bilbao & Itsasmuseum,"Pedaleando por Bilbao, turismo activo y sostenible. Disfruta y descubre la ciudad de una man...",plan,Experiencias Top,Bilbao,bizkaia,,43.2630126,-2.9349852,,,,False,True,False,False,False,4
,https://turismoa.euskadi.eus/es/top-viajes/goierri-montanero-por-un-dia/webtur00-content/es/,Goierri: montañero por un día,Los vascos tenemos una gran pasión por la montaña y en concreto en el Goierri hay 2...,plan,Experiencias Top,Zegama,gipuzkoa,,42.9511111,-2.3475,,,,False,False,False,False,False,6
,https://turismoa.euskadi.eus/es/top-viajes/goierri-fin-de-semana-en-territorio-idiazabal/webtur00-content/es/,Goierri: Fin de semana en territorio Idiazabal,Una experiencia de fin de semana rural en el Goierri es una escapada ideal para los que aprecian ...,plan,Experiencias Top,Idiazabal;Segura;Ordizia,gipuzkoa,,,,,,,True,False,False,False,False,8
,https://turismoa.euskadi.eus/es/top-viajes/ruta-de-la-gilda-y-la-tortilla-museo-guggenheim/webtur00-content/es/,Ruta de la gilda y la tortilla & Museo Guggenheim,"Ruta de la Gilda y la Tortilla, una aventura gastronómica en miniatura. Degustando cultura...",plan,Experiencias Top,Bilbao,bizkaia,,43.2630126,-2.9349852,,,,False,False,False,False,True,8
,https://turismoa.euskadi.eus/es/top-viajes/ruta-de-los-puentes-euskalmuseoa/webtur00-content/es/,Ruta de los puentes & Euskalmuseoa,Visita Bilbao recorriendo sus puentes y sus orillas. Visita el Euskal Museoa y descubre la histor...,plan,Experiencias Top,Bilbao,bizkaia,,43.2630126,-2.9349852,,,,True,False,False,True,False,6
,https://turismoa.euskadi.eus/es/top-viajes/goierri-fin-de-semana-en-basque-highlands/webtur00-content/es/,Goierri: Fin de semana en Basque Highlands,"¿Estás buscando un plan para el fin de semana? Tenemos lo que necesitas, un fin de ...",plan,Experiencias Top,Zerain;Segura;Ordizia;Idiazabal,gipuzkoa,,,,,,,False,False,False,True,False,8
,https://turismoa.euskadi.eus/es/top-viajes/lo-mejor-del-aire-y-de-la-tierra/webtur00-content/es/,Lo mejor del aire y de la tierra,Te proponemos una jornada muy completa que no te dejará indiferente. Empezamos con un vuel...,plan,Experiencias Top,Urduña/Orduña;Amurrio,bizkaia,,,,,,,False,False,False,False,False,8
,https://turismoa.euskadi.eus/es/top-viajes/senderismo-y-cultura-a-partes-iguales-en-amurrio/webtur00-content/es/,Senderismo y cultura a partes iguales en Amurrio,Te proponemos una jornada en Amurrio y sus alrededores. Por la mañana haremos una ruta de ...,plan,Experiencias Top,Amurrio;Artziniega,araba,,,,,,,False,False,False,True,False,6
,https://turismoa.euskadi.eus/es/top-viajes/aventura-y-cultura-deliciosa-combinacion/webtur00-content/es/,"Aventura y cultura, deliciosa combinación","Te proponemos una jornada completa, empezando con una actividad llena de adrenalina, barranquismo...",plan,Experiencias Top,Artziniega,araba,,43.1205796,-3.1294084,,,,False,False,False,True,True,4
,https://turismoa.euskadi.eus/es/top-viajes/una-experiencia-animal/webtur00-content/es/,Una experiencia animal,Te proponemos una jornada completa dedicada a los animales de la zona de Aiaraldea. Por la ma&nti...,plan,Experiencias Top,Okondo;Amurrio,araba,,,,,,,False,False,False,True,True,4
,https://turismoa.euskadi.eus/es/top-viajes/arabako-lautada-activa-sencilla-1-dia/webtur00-content/es/,Arabako Lautada activa sencilla 1 día,Te proponemos una escapada de un día de turismo activo por nuestra comarca que ofrece tant...,plan,Experiencias Top,Agurain/Salvatierra;Elburgo/Burgelu,araba,,,,,,,False,False,True,True,False,8
,https://turismoa.euskadi.eus/es/top-viajes/el-valle-salado/webtur00-content/es/,El Valle Salado,El lago Caicedo Yuso es el lago natural más importante del País Vasco. Disfruta del...,plan,Experiencias Top,Añana,araba,,42.8024433,-2.9856812,,,,False,False,False,True,True,4
,https://turismoa.euskadi.eus/es/top-viajes/arabako-lautada-natural-1-dia/webtur00-content/es/,Arabako Lautada natural 1 día,Te proponemos una escapada de un día a nuestra comarca para descubrir lo mejor de nuestra ...,plan,Experiencias Top,Barrundia;Agurain/Salvatierra,araba,,,,,,,False,False,True,False,False,6
,https://turismoa.euskadi.eus/es/top-viajes/dia-arqueologico/webtur00-content/es/,Día Arqueológico,"Descubre la rica historia arqueológica del yacimiento de Iruña Veleia, la torre de ...",plan,Experiencias Top,Iruña Oka/Iruña de Oca;Armiñón,araba,,,,,,,True,True,False,False,False,6
,https://turismoa.euskadi.eus/es/top-viajes/zarautz-naturaleza-y-diversion-en-familia/webtur00-content/es/,"Zarautz, naturaleza y diversión en familia","Arrancamos la mañana con este recorrido ameno, divertido y didáctico. Un juego inte...",plan,Experiencias Top,Zarautz,gipuzkoa,,43.284771,-2.1713967,,,,True,False,False,True,False,8
,https://turismoa.euskadi.eus/es/top-viajes/un-dia-de-desafios-en-zarautz/webtur00-content/es/,Un día de desafíos en Zarautz,"Dos desafíos para una jornada trepidante en Zarautz. Por la mañana, nos sumergiremo...",plan,Experiencias Top,Zarautz;Getaria,gipuzkoa,,,,,,,True,False,False,True,False,6
,https://turismoa.euskadi.eus/es/top-viajes/gastronomia-y-arte-tour-accesible/webtur00-content/es/,Gastronomía y arte: tour accesible,"En este tour disfrutaremos de una visita única al Mercado de Abastos, el mejor escaparate ...",plan,Experiencias Top,Vitoria-Gasteiz,araba,,42.850237,-2.6728711,,,,True,False,False,True,False,8
,https://turismoa.euskadi.eus/es/top-viajes/arabako-lautada-productores-locales-y-artesanos-1-dia/webtur00-content/es/,Arabako Lautada productores locales y artesanos 1 día,Te proponemos una escapada de un día a nuestra comarca para conozcas otra riqueza con la q...,plan,Experiencias Top,Agurain/Salvatierra,araba,,42.8493348,-2.388785,,,,False,False,True,True,False,4
,https://turismoa.euskadi.eus/es/top-viajes/portugalete-noble-villa-medieval-en-la-ria-del-nervion/webtur00-content/es/,"Portugalete,  Noble Villa Medieval en la Ría del Nervión","Proponemos esta jornada en la noble villa medieval de Portugalete, que acoge dos patrimonios de l...",plan,Experiencias Top,Portugalete,bizkaia,,43.3182479,-3.0211969,,,,False,False,False,False,True,6
,https://turismoa.euskadi.eus/es/top-viajes/santurtzi-ver-ballenas/webtur00-content/es/,"Santurtzi, ver ballenas","Proponemos esta jornada en Santurtzi, marinero por excelencia, donde disfrutaremos de una salida ...",plan,Experiencias Top,Santurtzi,bizkaia,,43.328128,-3.0336586,,,,False,False,False,False,True,6
,https://turismoa.euskadi.eus/es/top-viajes/barakaldo-verde/webtur00-content/es/,Barakaldo verde,"Proponemos esta jornada en Barakaldo, donde los amantes de los parques y jardines podrán a...",plan,Experiencias Top,Barakaldo,bizkaia,,43.2969875,-2.9862029,,,,True,False,True,False,True,8
,https://turismoa.euskadi.eus/es/top-viajes/arquitectura-del-vino-en-rioja-alavesa/webtur00-content/es/,Arquitectura del vino en Rioja Alavesa,Una ruta que te llevará por los edificios más vanguardistas de Rioja Alavesa. ...,plan,Experiencias Top,Laguardia;Elciego,araba,,,,,,,True,True,True,True,False,4
,https://turismoa.euskadi.eus/es/top-viajes/rioja-alavesa-de-muralla-en-muralla/webtur00-content/es/,Rioja Alavesa de muralla en muralla,"Rioja Alavesa presume de tener un conjunto de 19 antiguas villas medievales, algunas de ellas con...",plan,Experiencias Top,Laguardia;Labastida/Bastida,araba,,,,,,,True,True,False,True,True,4
,https://turismoa.euskadi.eus/es/top-viajes/naturaleza-y-relax-rioja-alavesa/webtur00-content/es/,Naturaleza y relax Rioja Alavesa,"Esta ruta de 2 días por Rioja Alavesa, te llevará a desconectar mientras descubres ...",plan,Experiencias Top,Laguardia;Navaridas;Elciego;Leza,araba,,,,,,,False,False,True,False,False,4
,https://turismoa.euskadi.eus/es/top-viajes/los-indianos-y-su-legado/webtur00-content/es/,Los Indianos y su legado,"La Villa de Lanestosa y el barrio de Concha en Karrantza, están repletos de casas de ...",plan,Experiencias Top,Karrantza Harana/Valle de Carranza,bizkaia,,,,,,,False,False,False,False,False,6
,https://turismoa.euskadi.eus/es/top-viajes/conecta-con-gorbeia-un-destino-ecoturista/webtur00-content/es/,"Conecta con Gorbeia, un destino ecoturista","Gorbeialdea es un paraíso para la práctica del ecoturismo, entre otras muchas cosas...",plan,Experiencias Top,Zuia,araba,,42.95637929999999,-2.8200531,,,,False,False,False,True,False,8
,https://turismoa.euskadi.eus/es/top-viajes/mar-y-txakoli-en-getxo/webtur00-content/es/,Mar y txakolí en Getxo,"La ría de Bilbao, El Abra y los acantilados de Uribe kosta son paisajes únicos; y d...",plan,Experiencias Top,Getxo,bizkaia,,43.3387367,-3.0081319,,,,False,True,False,False,False,4
,https://turismoa.euskadi.eus/es/top-viajes/getxo-al-completo/webtur00-content/es/,Getxo al completo,"Getxo es un pueblo con encanto, diferente y lleno de lugares mágicos. Getxo es un pue...",plan,Experiencias Top,Getxo,bizkaia,,43.3387367,-3.0081319,,,,True,False,False,False,True,6
,https://turismoa.euskadi.eus/es/top-viajes/getxo-gastronomico/webtur00-content/es/,Getxo gastronómico,"El País Vasco ofrece a sus visitantes una fenomenal cultura gastronómica, y Ge...",plan,Experiencias Top,Getxo,bizkaia,,43.3387367,-3.0081319,,,,True,False,False,False,False,8
,https://turismoa.euskadi.eus/es/top-viajes/getxo-desde-el-mar/webtur00-content/es/,Getxo desde el mar,¿Estás planeando descubrir la vela? ¿Quieres salir al mar? Te lo ponen ...,plan,Experiencias Top,Getxo,bizkaia,,43.3387367,-3.0081319,,,,True,False,False,True,False,6
,https://turismoa.euskadi.eus/es/top-viajes/ruta-de-los-hayedos/webtur00-content/es/,Ruta de los hayedos,Son varias las zonas con hayedos trasmochos que encontramos en Gorbeia. Si quieres darte un bonit...,plan,Experiencias Top,Dima;Orozko;Zeanuri;Otxandio,bizkaia,,,,,,,True,False,False,False,False,6
,https://turismoa.euskadi.eus/es/top-viajes/viajar-en-el-tiempo-desde-el-caserio-tradicional-a-la-casa-moderna-y-villa-de-otxandio/webtur00-content/es/,Viajar en el tiempo desde el caserío tradicional a la casa moderna y villa de Otxandio,Que os parece si os contamos que en apenas dos horas estás en un auténtico sal&oacu...,plan,Experiencias Top,Otxandio;Orozko,bizkaia,,,,,,,False,True,False,True,False,6
,https://turismoa.euskadi.eus/es/top-viajes/descubre-orozko-ojo-de-atxulaur-y-yincana-por-zubiaur/webtur00-content/es/,Descubre Orozko: ojo de Atxulaur y yincana por Zubiaur,El recorrido por Gorbeia parte del área recreativa de Altzakorta (Orozko) y te lleva hasta...,plan,Experiencias Top,Orozko,bizkaia,,43.1075643,-2.9112964,,,,False,False,False,False,False,6
,https://turismoa.euskadi.eus/es/top-viajes/historia-del-vino-en-rioja-alavesa/webtur00-content/es/,Historia del vino en Rioja Alavesa,La historia del vino en Rioja Alavesa se remonta a la antigua Roma. Con esta ruta podrás d...,plan,Experiencias Top,Elciego;Labastida/Bastida;Laguardia,araba,,,,,,,False,True,False,True,False,6
,https://turismoa.euskadi.eus/es/top-viajes/miradores-y-paisajes-infinitos-en-la-rioja-alavesa/webtur00-content/es/,Miradores y paisajes infinitos en la Rioja Alavesa,Esta ruta nos llevará a disfrutar del singular paisaje de Rioja Alavesa con un mar de vi&n...,plan,Experiencias Top,Laguardia;Elciego;Labastida/Bastida,araba,,,,,,,True,True,False,True,False,8
,https://turismoa.euskadi.eus/es/top-viajes/aceite-y-vino-en-rioja-alavesa/webtur00-content/es/,Aceite y vino en Rioja Alavesa,"Entre los viñedos que caracterizan a Rioja Alavesa, podemos encontrar uno de los grandes d...",plan,Experiencias Top,Labastida/Bastida;Laguardia;Elciego;Oyón-Oion,araba,,,,,,,False,True,False,True,False,8
,https://turismoa.euskadi.eus/es/top-viajes/descubre-rioja-alavesa-en-3-dias/webtur00-content/es/,Descubre Rioja Alavesa en 3 días,"Aunque el nombre de Rioja Alavesa evoca vino, esta comarca al Sur de Álava ofrece much&iac...",plan,Experiencias Top,Labastida/Bastida;Samaniego,araba,,,,,,,False,False,False,True,False,8
